{
  "id": "chassis_brake_validation_specs",
  "primaryKey": [
    "test_id"
  ],
  "foreignKeys": [
    {
      "columns": [
        "vehicle_variant"
      ],
      "references": {
        "table": "vehicle_variant_configuration_specs",
        "columns": [
          "variant_id"
        ]
      }
    }
  ],
  "columns": [
    {
      "name": "test_id",
      "type": "string",
      "label": "Test ID",
      "nullable": false
    },
    {
      "name": "vehicle_variant",
      "type": "string",
      "label": "Vehicle Variant",
      "nullable": false
    },
    {
      "name": "axle_config",
      "type": "string",
      "label": "Axle Config",
      "nullable": false
    },
    {
      "name": "front_spring_rate_n_mm",
      "type": "decimal",
      "label": "Front Spring Rate",
      "nullable": false,
      "unit": {
        "code": "N/mm",
        "label": "N/mm"
      }
    },
    {
      "name": "rear_spring_rate_n_mm",
      "type": "decimal",
      "label": "Rear Spring Rate",
      "nullable": false,
      "unit": {
        "code": "N/mm",
        "label": "N/mm"
      }
    },
    {
      "name": "damping_front_ns_m",
      "type": "integer",
      "label": "Front Damping",
      "nullable": false,
      "unit": {
        "code": "N.s/m",
        "label": "Ns/m"
      }
    },
    {
      "name": "damping_rear_ns_m",
      "type": "integer",
      "label": "Rear Damping",
      "nullable": false,
      "unit": {
        "code": "N.s/m",
        "label": "Ns/m"
      }
    },
    {
      "name": "tire_size",
      "type": "string",
      "label": "Tire Size",
      "nullable": false
    },
    {
      "name": "rotor_front_mm",
      "type": "integer",
      "label": "Front Rotor",
      "nullable": false,
      "unit": {
        "code": "mm",
        "label": "mm"
      }
    },
    {
      "name": "rotor_rear_mm",
      "type": "integer",
      "label": "Rear Rotor",
      "nullable": false,
      "unit": {
        "code": "mm",
        "label": "mm"
      }
    },
    {
      "name": "stop_distance_100_0_m",
      "type": "decimal",
      "label": "Stop Distance 100-0",
      "nullable": false,
      "unit": {
        "code": "m",
        "label": "m"
      }
    },
    {
      "name": "lateral_grip_g",
      "type": "decimal",
      "label": "Lateral Grip",
      "nullable": false,
      "unit": {
        "code": "g",
        "label": "g"
      }
    },
    {
      "name": "stability_margin_pct",
      "type": "decimal",
      "label": "Stability Margin",
      "nullable": false,
      "unit": {
        "code": "percent",
        "label": "%"
      }
    },
    {
      "name": "validation_date",
      "type": "date",
      "label": "Validation Date",
      "nullable": false
    }
  ]
}
